{
  "schema_version": 1,
  "as_of": "2026-10-04",
  "rector_version": "2.5.2",
  "rules": [
    {
      "id": "p84-implicit-nullable",
      "rule": "Rector\\Php84\\Rector\\Param\\ExplicitNullableParamTypeRector",
      "kind": "compat",
      "deprecated_in": "8.4",
      "removed_in": null,
      "output_min_php": "7.1",
      "drupal_safe": true,
      "src": "https://www.php.net/manual/en/migration84.deprecated.php",
      "rule_src": "https://github.com/rectorphp/rector-src/tree/2.5.2/rules/Php84/Rector/Param/ExplicitNullableParamTypeRector.php",
      "verified": true,
      "construct": "Foo $x = NULL (an implicitly nullable parameter) becomes ?Foo $x = NULL"
    },
    {
      "id": "p82-interpolation",
      "rule": "Rector\\Php82\\Rector\\Encapsed\\VariableInStringInterpolationFixerRector",
      "kind": "compat",
      "deprecated_in": "8.2",
      "removed_in": null,
      "output_min_php": null,
      "drupal_safe": true,
      "src": "https://www.php.net/manual/en/migration82.deprecated.php",
      "rule_src": "https://github.com/rectorphp/rector-src/tree/2.5.2/rules/Php82/Rector/Encapsed/VariableInStringInterpolationFixerRector.php",
      "verified": true,
      "construct": "\"${var}\" interpolation"
    },
    {
      "id": "p82-utf8-encode",
      "rule": "Rector\\Php82\\Rector\\FuncCall\\Utf8DecodeEncodeToMbConvertEncodingRector",
      "kind": "compat",
      "deprecated_in": "8.2",
      "removed_in": null,
      "output_min_php": null,
      "drupal_safe": null,
      "src": "https://www.php.net/manual/en/migration82.deprecated.php",
      "rule_src": "https://github.com/rectorphp/rector-src/tree/2.5.2/rules/Php82/Rector/FuncCall/Utf8DecodeEncodeToMbConvertEncodingRector.php",
      "verified": true,
      "construct": "utf8_encode()/utf8_decode()",
      "note": "The rewrite calls mb_convert_encoding(): Drupal-safe only where mbstring is guaranteed; unaudited (AR-11)."
    },
    {
      "id": "p83-get-class-no-args",
      "rule": "Rector\\Php83\\Rector\\FuncCall\\RemoveGetClassGetParentClassNoArgsRector",
      "kind": "compat",
      "deprecated_in": "8.3",
      "removed_in": null,
      "output_min_php": null,
      "drupal_safe": true,
      "src": "https://www.php.net/manual/en/migration83.deprecated.php",
      "rule_src": "https://github.com/rectorphp/rector-src/tree/2.5.2/rules/Php83/Rector/FuncCall/RemoveGetClassGetParentClassNoArgsRector.php",
      "verified": true,
      "construct": "get_class()/get_parent_class() without arguments"
    },
    {
      "id": "p84-csv-escape",
      "rule": "Rector\\Php84\\Rector\\FuncCall\\AddEscapeArgumentRector",
      "kind": "compat",
      "deprecated_in": "8.4",
      "removed_in": null,
      "output_min_php": null,
      "drupal_safe": true,
      "src": "https://www.php.net/manual/en/migration84.deprecated.php",
      "rule_src": "https://github.com/rectorphp/rector-src/tree/2.5.2/rules/Php84/Rector/FuncCall/AddEscapeArgumentRector.php",
      "verified": true,
      "construct": "fputcsv()/fgetcsv()/str_getcsv() relying on the default escape argument"
    },
    {
      "id": "p85-backtick",
      "rule": "Rector\\Php85\\Rector\\ShellExec\\ShellExecFunctionCallOverBackticksRector",
      "kind": "compat",
      "deprecated_in": "8.5",
      "removed_in": null,
      "output_min_php": null,
      "drupal_safe": true,
      "src": "https://www.php.net/manual/en/migration85.deprecated.php",
      "rule_src": "https://github.com/rectorphp/rector-src/tree/2.5.2/rules/Php85/Rector/ShellExec/ShellExecFunctionCallOverBackticksRector.php",
      "verified": true,
      "construct": "the backtick operator"
    },
    {
      "id": "p85-case-semicolon",
      "rule": "Rector\\Php85\\Rector\\Switch_\\ColonAfterSwitchCaseRector",
      "kind": "compat",
      "deprecated_in": "8.5",
      "removed_in": null,
      "output_min_php": null,
      "drupal_safe": true,
      "src": "https://www.php.net/manual/en/migration85.deprecated.php",
      "rule_src": "https://github.com/rectorphp/rector-src/tree/2.5.2/rules/Php85/Rector/Switch_/ColonAfterSwitchCaseRector.php",
      "verified": true,
      "construct": "case X; terminated with a semicolon"
    },
    {
      "id": "p85-set-accessible",
      "rule": "Rector\\Php81\\Rector\\MethodCall\\RemoveReflectionSetAccessibleCallsRector",
      "kind": "compat",
      "deprecated_in": "8.5",
      "removed_in": null,
      "output_min_php": "8.1",
      "drupal_safe": true,
      "src": "https://www.php.net/manual/en/migration85.deprecated.php",
      "rule_src": "https://github.com/rectorphp/rector-src/tree/2.5.2/rules/Php81/Rector/MethodCall/RemoveReflectionSetAccessibleCallsRector.php",
      "verified": true,
      "construct": "Reflection*::setAccessible() (a no-op since PHP 8.1)"
    },
    {
      "id": "p85-null-offset",
      "rule": "Rector\\Php85\\Rector\\FuncCall\\ArrayKeyExistsNullToEmptyStringRector",
      "kind": "compat",
      "deprecated_in": "8.5",
      "removed_in": null,
      "output_min_php": null,
      "drupal_safe": true,
      "src": "https://www.php.net/manual/en/migration85.deprecated.php",
      "rule_src": "https://github.com/rectorphp/rector-src/tree/2.5.2/rules/Php85/Rector/FuncCall/ArrayKeyExistsNullToEmptyStringRector.php",
      "verified": true,
      "construct": "null as an array offset in array_key_exists()"
    },
    {
      "id": "p85-debuginfo-null",
      "rule": "Rector\\Php85\\Rector\\ClassMethod\\NullDebugInfoReturnRector",
      "kind": "compat",
      "deprecated_in": "8.5",
      "removed_in": null,
      "output_min_php": null,
      "drupal_safe": true,
      "src": "https://www.php.net/manual/en/migration85.deprecated.php",
      "rule_src": "https://github.com/rectorphp/rector-src/tree/2.5.2/rules/Php85/Rector/ClassMethod/NullDebugInfoReturnRector.php",
      "verified": true,
      "construct": "__debugInfo() returning null"
    },
    {
      "id": "p85-chr-range",
      "rule": "Rector\\Php85\\Rector\\FuncCall\\ChrArgModuloRector",
      "kind": "compat",
      "deprecated_in": "8.5",
      "removed_in": null,
      "output_min_php": null,
      "drupal_safe": true,
      "src": "https://www.php.net/manual/en/migration85.deprecated.php",
      "rule_src": "https://github.com/rectorphp/rector-src/tree/2.5.2/rules/Php85/Rector/FuncCall/ChrArgModuloRector.php",
      "verified": true,
      "construct": "chr() with an integer outside 0..255"
    },
    {
      "id": "p85-ord-single-byte",
      "rule": "Rector\\Php85\\Rector\\FuncCall\\OrdSingleByteRector",
      "kind": "compat",
      "deprecated_in": "8.5",
      "removed_in": null,
      "output_min_php": null,
      "drupal_safe": true,
      "src": "https://www.php.net/manual/en/migration85.deprecated.php",
      "rule_src": "https://github.com/rectorphp/rector-src/tree/2.5.2/rules/Php85/Rector/FuncCall/OrdSingleByteRector.php",
      "verified": true,
      "construct": "ord() of a string that is not a single byte"
    },
    {
      "id": "p80-optional-before-required",
      "rule": "Rector\\CodeQuality\\Rector\\ClassMethod\\OptionalParametersAfterRequiredRector",
      "kind": "compat",
      "deprecated_in": "8.0",
      "removed_in": null,
      "output_min_php": null,
      "drupal_safe": null,
      "src": "https://www.php.net/manual/en/migration80.deprecated.php",
      "rule_src": "https://github.com/rectorphp/rector-src/tree/2.5.2/rules/CodeQuality/Rector/ClassMethod/OptionalParametersAfterRequiredRector.php",
      "verified": true,
      "construct": "a parameter with a default value followed by a required one",
      "note": "May change a public signature; unaudited (AR-11)."
    },
    {
      "id": "p74-implode-order",
      "rule": "Rector\\CodingStyle\\Rector\\FuncCall\\ConsistentImplodeRector",
      "kind": "compat",
      "deprecated_in": "7.4",
      "removed_in": "8.0",
      "output_min_php": null,
      "drupal_safe": true,
      "src": "https://www.php.net/manual/en/migration74.deprecated.php ; https://www.php.net/manual/en/migration80.incompatible.php",
      "rule_src": "https://github.com/rectorphp/rector-src/tree/2.5.2/rules/CodingStyle/Rector/FuncCall/ConsistentImplodeRector.php",
      "verified": true,
      "construct": "implode() with its parameters in the historical order"
    },
    {
      "id": "deny-array-first-class-callable",
      "rule": "Rector\\Php81\\Rector\\Array_\\ArrayToFirstClassCallableRector",
      "kind": "deny",
      "deprecated_in": null,
      "removed_in": null,
      "output_min_php": "8.1",
      "drupal_safe": false,
      "src": "https://www.php.net/manual/en/functions.first_class_callable_syntax.php",
      "rule_src": "https://github.com/rectorphp/rector-src/tree/2.5.2/rules/Php81/Rector/Array_/ArrayToFirstClassCallableRector.php",
      "verified": true,
      "reason": "Turns Form/Render API callbacks such as '#submit' => [[$this, 'submitX']] into $this->submitX(...): a closure is not serializable, so a cached form (#ajax, form state cache) fatals. templates/rector.php.tmpl skips it (S4); check-port-safety.sh flags such a closure."
    },
    {
      "id": "deny-override-on-methods",
      "rule": "Rector\\Php83\\Rector\\ClassMethod\\AddOverrideAttributeToOverriddenMethodsRector",
      "kind": "deny",
      "deprecated_in": null,
      "removed_in": null,
      "output_min_php": "8.3",
      "drupal_safe": false,
      "src": "https://www.php.net/manual/en/class.override.php",
      "rule_src": "https://github.com/rectorphp/rector-src/tree/2.5.2/rules/Php83/Rector/ClassMethod/AddOverrideAttributeToOverriddenMethodsRector.php",
      "verified": true,
      "reason": "Adds #[\\Override] by looking at the test-bed core only: a method that exists in the parent only on newer cores then fatals on PHP 8.3+ with every older core the module declares. templates/rector.php.tmpl skips it (S4); check-port-safety.sh flags #[\\Override] while the range spans Drupal 10."
    },
    {
      "id": "deny-readonly-property",